desc,tsne_x,tsne_y,desc_clear,target,target_num
"Блеск и глянец, категории: ПРОСТРАНСТВА Некрасовка",-8.877761,9.942988,блеск глянец  пространство некрасовка,пространство,54
"Конская динамика, категории: Восточный Другие виды спорта Открытые площадки",-1.410775,-13.088067,конский динамика  восточный вид спорт открытый площадка,вид,13
"Инь-янь жк, категории: Жилые комплексы и подъезды Замоскворечье",7.223749,-36.022213,инь янь жк  жилой комплекс подъезд замоскворечье,комплекс,32
"Ранчо в лесу, категории: Ярославский Другие виды спорта Открытые площадки",-0.84904003,-12.683453,ранчо лес  ярославский вид спорт открытый площадка,вид,13
"Крыша сердце столицы, категории: Крыши Тверской",11.705265,-15.706919,крыша сердце столица  крыша тверская,крыша,34
"Рыбацкое место, категории: Озера, реки, карьеры Северный",-23.180468,21.705122,рыбацкий место  озеро река карьера северный,озеро,40
"Зеленый остров, категории: Жилые комплексы и подъезды Крыши Гаражи и парковки Замоскворечье",11.823049,-34.844387,зеленый остров  жилой комплекс подъезд крыша гараж парковка замоскворечье,комплекс,32
"Тишь да гладь , категории: Озера, реки, карьеры Некрасовка",-23.09094,19.05158,тишь гладь  озеро река карьера некрасовка,озеро,40
"Гармония направляющих, категории: Жилые комплексы и подъезды Крыши Гаражи и парковки Соколиная Гора",12.992131,-33.701473,гармония направлять  жилой комплекс подъезд крыша гараж парковка соколиный гора,комплекс,32
"Уральские мотивы, категории: Озера, реки, карьеры Северное Медведково",-23.300497,21.986393,уральский мотив  озеро река карьера северный медведково,озеро,40
"Гранд жк, категории: Жилые комплексы и подъезды Крыши Гаражи и парковки Можайский район",11.346047,-35.337902,гранд жк  жилой комплекс подъезд крыша гараж парковка можайский район,комплекс,32
"в мире трансформеров, категории: Промзоны Печатники",-2.8683863,-8.616451,мир трансформер  промзона печатник,промзона,53
"Вечерний жк, категории: Жилые комплексы и подъезды Гаражи и парковки Гагаринский район Открытые площадки",10.786793,-35.989567,вечерний жк  жилой комплекс подъезд гараж парковка гагаринский район открытый площадка,комплекс,32
Пространство для мероприятий (лофт). С кирпичной отделкой и множеством комнат.  Москва,12.61798,38.586666,пространство мероприятие лофт кирпичный отделка множество комната москва,пространство,54
заезд авто,15.514716,-7.232444,заезд авто,none,0
Лофт трёхэтажный в дизайнерском стиле со своей верандой.  Москва,18.113316,20.772045,лофт трехэтажный дизайнерский стиль свой веранда москва,лофт,36
Есть веранда.,16.993195,-3.49766,веранда,none,0
Яркий лофт в дизайнерском стиле.,21.276709,22.020144,яркий лофт дизайнерский стиль,лофт,36
Лофт в черно-белом стиле.,21.16113,23.797348,лофт черно-белый стиль,лофт,36
Светлое пространство в классическом стиле .,37.04544,6.778115,светлый пространство классический стиль,пространство,54
Лофт в стиле минимализм с большими окнами,29.418919,16.310617,лофт стиль минимализм большой окно,лофт,36
Светлое пространство с большими окнами.,35.914192,11.4753475,светлый пространство большой окно,пространство,54
Лофт в серых тонах и с большими окнами.,36.553932,13.159066,лофт серый тон большой окно,лофт,36
Двухуровневый лофт-офис с большими окнами.  Москва,34.25839,19.108053,двухуровневый лофт офис большой окно москва,лофт,36
"Лофт для мероприятий . В интерьере присутствуют: граффити, машины, диваны , кресла, камин.  Москва",33.064167,44.714073,лофт мероприятие интерьер присутствовать граффити машина диван кресло камин москва,лофт,36
Пространство для мероприятий (лофт). С кирпичной отделкой и множеством комнат.  Москва,12.586969,38.589233,пространство мероприятие лофт кирпичный отделка множество комната москва,пространство,54
заезд авто,15.510777,-7.1835055,заезд авто,none,0
Лофт трёхэтажный в дизайнерском стиле со своей верандой.  Москва,18.116776,20.64129,лофт трехэтажный дизайнерский стиль свой веранда москва,лофт,36
Есть веранда.,16.871826,-3.621843,веранда,none,0
Яркий лофт в дизайнерском стиле.,21.313786,22.02659,яркий лофт дизайнерский стиль,лофт,36
Лофт в черно-белом стиле.,21.06315,23.828548,лофт черно-белый стиль,лофт,36
Светлое пространство в классическом стиле .,36.991615,6.680579,светлый пространство классический стиль,пространство,54
Лофт в стиле минимализм с большими окнами,29.563698,15.954758,лофт стиль минимализм большой окно,лофт,36
Светлое пространство с большими окнами.,36.16959,11.222611,светлый пространство большой окно,пространство,54
Лофт в серых тонах и с большими окнами.,36.53798,13.3493805,лофт серый тон большой окно,лофт,36
Двухуровневый лофт-офис с большими окнами.  Москва,34.242134,19.19463,двухуровневый лофт офис большой окно москва,лофт,36
"Лофт для мероприятий . В интерьере присутствуют: граффити, машины, диваны , кресла, камин.  Москва",33.077404,44.69718,лофт мероприятие интерьер присутствовать граффити машина диван кресло камин москва,лофт,36
Пространство для мероприятий (лофт). С кирпичной отделкой и множеством комнат.  Москва,12.626654,38.587368,пространство мероприятие лофт кирпичный отделка множество комната москва,пространство,54
заезд авто,15.490059,-7.2900653,заезд авто,none,0
Лофт трёхэтажный в дизайнерском стиле со своей верандой.  Москва,18.067507,20.61189,лофт трехэтажный дизайнерский стиль свой веранда москва,лофт,36
Есть веранда.,17.17735,-3.3158808,веранда,none,0
Яркий лофт в дизайнерском стиле.,21.24784,21.987883,яркий лофт дизайнерский стиль,лофт,36
Лофт в черно-белом стиле.,21.438189,23.91309,лофт черно-белый стиль,лофт,36
Светлое пространство в классическом стиле .,37.028404,6.8272905,светлый пространство классический стиль,пространство,54
Лофт в стиле минимализм с большими окнами,29.454084,15.899781,лофт стиль минимализм большой окно,лофт,36
Светлое пространство с большими окнами.,35.822727,11.314357,светлый пространство большой окно,пространство,54
Лофт в серых тонах и с большими окнами.,36.84146,13.401902,лофт серый тон большой окно,лофт,36
Двухуровневый лофт-офис с большими окнами.  Москва,34.241634,19.199211,двухуровневый лофт офис большой окно москва,лофт,36
"Лофт для мероприятий . В интерьере присутствуют: граффити, машины, диваны , кресла, камин.  Москва",33.072105,44.701748,лофт мероприятие интерьер присутствовать граффити машина диван кресло камин москва,лофт,36
Самолёт с кожаными креслами.  МО,14.326678,-7.273126,самолет кожаный кресло мо,самолет,60
Ангар для самолетов и вертолетов.  Московская область,14.871891,56.616142,ангар самолет вертолет московский область,ангар,2
"Аэропорт, просторные внутренние пространства, эскалатор, металлические конструкции перекрытия.",38.803013,-44.089672,аэропорт просторный внутренний пространство эскалатор металлический конструкция перекрытие,аэропорт,5
"Аэропорт, большие внутренние объемы помещений, колонны, большие площади остекления, открытые металлические конструкции.",55.560226,-42.06096,аэропорт большой внутренний объем помещение колонна большой площадь остекление открытый металлический конструкция,аэропорт,5
Черный бизнес-джет.  Москва,72.8413,-5.135985,черный бизнес джет москва,бизнес,10
Ангар для стоянки бизнес-джетов.  Москва,64.51506,4.2059875,ангар стоянка бизнес джет москва,ангар,2
Бизнес-джет   Москва								  ЦАО,64.87268,-15.990102,бизнес джет москва цао,бизнес,10
Москва								  ЦАО,47.353786,-18.880278,москва цао,none,0
"Салон самолета ИЛ-86, предназначенный для обучения сотрудников гражданской авиации",27.410973,-66.6643,салон самолет ил 86 предназначать обучение сотрудник гражданский авиация,салон,59
"Тренажер для обучения бортпроводников, имитирующий салон самолета",13.588192,-66.14657,тренажер обучение бортпроводник имитировать салон самолет,салон,59
Темное пространство .  Москва,22.082882,5.6494074,темный пространство москва,пространство,54
"Светлое помещение с панорамными окнами и высокими потолками. Стены оформлены в стиле граффити,  большая зона отдыха.",31.512505,4.2954774,светлый помещение панорамный окно высокий потолок стена оформлять стиль граффити большой зона отдых,помещение,51
"Небольшая мойка автомобилей, есть зона отдыха.",-5.1588864,-2.7801423,небольшой мойка автомобиль зона отдых,none,0
Автомойка с зоной отдыха.,8.747182,5.432803,автомойка зона отдых,none,0
Автомойка с большими окнами .,30.870895,15.307645,автомойка большой окно,none,0
Большой двухуровневый автосалон.  Москва,26.425795,9.917429,большой двухуровневый автосалон москва,none,0
Светлая просторная автомойка с кафельным покрытием.,-20.155935,-7.4767785,светлый просторный автомойка кафельный покрытие,none,0
Москва								  ЦАО,48.73932,-19.444447,москва цао,none,0
"Асфальтированная дорога, которая переходит в дорогу без покрытия, идущую через поле.",-21.545433,-13.396787,асфальтировать дорога который переходить дорога покрытие идти поле,дорога,19
Заправка   МО,20.00435,-3.3069324,заправка мо,none,0
Подземная 2-хуровневая парковка.  Москва								  ЮАО,5.5435047,-26.122835,подземный 2 хуровневый парковка москва юао,парковка,44
"Открытая парковка в городской среде и крупными зелеными насаждениями, тротуарная плитка, асфальт, арка в здании, постройки советского периода.",7.969563,9.144521,открытый парковка городской среда крупный зеленый насаждение тротуарный плитка асфальт арка здание постройка советский период,парковка,44
Москва								  САО,46.229477,-17.695541,москва сао,none,0
"Банк, высокие потолки, светлое пространство.",34.405525,5.0403695,банк высокий потолок светлый пространство,пространство,54
Двухуровневый лофт-офис с большими окнами.  Москва,34.237926,19.18085,двухуровневый лофт офис большой окно москва,лофт,36
"Крупный конгресс-центр включает в себя большой зал, переговорную, холл и зону кофе.",13.899311,11.543333,крупный конгресс центр включать большой зал переговорный холл зона кофе,центр,74
"Переговорная с современным интерьером в светлых тонах с большими окнами и винтовой лестницей,  26 посадочных мест.  Москва								  СВАО",30.203117,23.614859,переговорный современный интерьер светлый тон большой окно винтовой лестница 26 посадочный место москва свао,интерьер,23
"Современная городская застройка, бизнес среда, комплекс Москва Сити, высотные здания, стеклянные фасады, внутренняя территория.",23.211807,13.392673,современный городской застройка бизнес среда комплекс москва сити высотный здание стеклянный фасад внутренний территория,бизнес,10
"Современный холл в бизнес центре, интересная стеклянная конструкция используемая в рекреации , стеклянный фасад, современный интерьер.",27.823177,4.3129387,современный холл бизнес центр интересный стеклянный конструкция использовать рекреация стеклянный фасад современный интерьер,холл,73
заезд авто,15.523564,-7.196182,заезд авто,none,0
Лофт трёхэтажный в дизайнерском стиле со своей верандой.  Москва,18.121967,20.688906,лофт трехэтажный дизайнерский стиль свой веранда москва,лофт,36
Есть веранда.,17.2228,-3.1672177,веранда,none,0
Яркий лофт в дизайнерском стиле.,21.340141,21.9564,яркий лофт дизайнерский стиль,лофт,36
Лофт в черно-белом стиле.,20.97703,24.052732,лофт черно-белый стиль,лофт,36
Светлое пространство в классическом стиле .,37.045807,6.8641405,светлый пространство классический стиль,пространство,54
Лофт в стиле минимализм с большими окнами,29.32496,16.1801,лофт стиль минимализм большой окно,лофт,36
Светлое пространство с большими окнами.,36.158936,11.28961,светлый пространство большой окно,пространство,54
Лофт в серых тонах и с большими окнами.,36.77537,12.916336,лофт серый тон большой окно,лофт,36
"Лофт для мероприятий . В интерьере присутствуют: граффити, машины, диваны , кресла, камин.  Москва",33.071957,44.706264,лофт мероприятие интерьер присутствовать граффити машина диван кресло камин москва,лофт,36
Пространство для мероприятий (лофт). С кирпичной отделкой и множеством комнат.  Москва,12.609084,38.586315,пространство мероприятие лофт кирпичный отделка множество комната москва,пространство,54
Бизнес центр в классическом стиле с большими окнами и длинными коридорами .  Москва,23.687368,12.946691,бизнес центр классический стиль большой окно длинный коридор москва,бизнес,10
"Бизнес центр с просторными кабинетами , большими окнами и кафе.  Москва",32.84935,16.401155,бизнес центр просторный кабинет большой окно кафе москва,бизнес,10
"Бизнес центр с опен спецмашин, кафе и зоной, находящейся в строительном режиме.  Москва",7.05311,21.780935,бизнес центр опен спецмашина кафе зона находиться строительный режим москва,бизнес,10
"Бизнес центр в дизайнерском стиле, часть находится в стадии ремонта , в бизнес центре также имеется подвал и чердак .  Москва",-20.546566,25.481085,бизнес центр дизайнерский стиль часть находиться стадия ремонт бизнес центр также иметься подвал чердак москва,бизнес,10
Москва,51.6729,24.13969,москва,none,0
Москва,49.622772,24.662022,москва,none,0
Москва,48.20936,23.047445,москва,none,0
Москва,50.973198,22.692297,москва,none,0
Москва,48.706223,24.53959,москва,none,0
Москва,50.098457,23.636688,москва,none,0
"При входе в бизнес-центр расположен просторный светлый атриум с водной стеной и панорамной крышей,. В центре атриума лобби-бар, в здании также располагаются торговая галерея и рестораны. Внутренние этажи просторные и светлые за счет панорамного остекления  Москва",5.997697,17.515127,вход бизнес-центр располагать просторный светлый атриум водный стена панорамный крыша центр атриум лобби барин здание также располагаться торговый галерея ресторан внутренний этаж просторный светлый счет панорамный остекление москва,крыша,34
Москва,50.622726,22.56486,москва,none,0
Москва,49.60158,25.797167,москва,none,0
Москва,50.14494,25.044611,москва,none,0
Москва,50.35556,24.261505,москва,none,0
Территория среди объектов современного стиля с цветными фасадами.,20.508986,15.599157,территория среди объект современный стиль цветной фасад,none,0
Москва,48.007298,24.169703,москва,none,0
Москва,49.788876,22.989252,москва,none,0
Москва,49.25855,25.12299,москва,none,0
Москва,49.74974,21.665754,москва,none,0
Москва,47.48204,23.696302,москва,none,0
Москва,49.76293,23.569593,москва,none,0
Москва,49.351707,22.776293,москва,none,0
Москва,48.4689,22.64061,москва,none,0
Москва,49.19067,24.06025,москва,none,0
Москва,49.351406,22.295048,москва,none,0
Москва,49.33071,23.484987,москва,none,0
Территория жилого комплекса с прогулочной аллеей и велодорожками.  Москва,1.1136202,-22.698244,территория жилой комплекс прогулочный аллея велодорожка москва,комплекс,32
Белый дом в центре Москвы со своей парковкой.  Москва,9.512094,-1.6513802,белый дом центр москва свой парковка москва,дом,18
Переговоры в разных стилях.  Москва,6.1283097,6.4718504,переговоры разный стиль москва,none,0
Просторный светлый конгресс-холл с красными креслами,-19.844069,-7.6630354,просторный светлый конгресс-холл красный кресло,none,0
Конференц-зал в темных тонах,18.89266,4.773725,конференц-зал темный тон,none,0
Просторный когресс-холл круглой формы с балконом и красными креслами,-8.881619,-6.710134,просторный когресс холл круглый форма балкон красный кресло,холл,73
Светлый квадратный конгресс-холл с классической сценой,-12.73906,-14.245058,светлый квадратный конгресс-холл классический сцена,none,0
Просторный конгресс-холл со стеклянной крышей,-19.69595,-7.733299,просторный конгресс-холл стеклянный крыша,крыша,34
Светлый конгресс-холл прямоугольной формы,-9.10241,-13.599024,светлый конгресс-холл прямоугольный форма,none,0
Светлый зал с большими панорамными окнами и отделкой серым бетоном.  Москва								  ЦАО,38.156174,13.272331,светлый зал большой панорамный окно отделка серый бетон москва цао,зал,20
