desc,tsne_x,tsne_y,desc_clear,target,target_num
"СПОРТИВНЫЙ КЛУБ СО СКАЛОДРОМОМ, категории: Фитнес-клубы Ясенево",-29.001503,22.482035,спортивный клуб скалодром  фитнес-клуб ясенево,клуб,31
"РАЙОННАЯ ШКОЛА С БИБЛИОТЕКОЙ И ЛЕТНИМ САДОМ, категории: Школы Таганский Библиотеки Мастерские и студии Футбол, баскетболл, волейболл, теннис",-33.243835,3.481059,районный школа библиотека летний сад  школа таганский библиотека мастерская студия футбол баскетболла волейболла теннис,школа,75
"СЕМЕЙНЫЙ ТАУНХАУС С БАССЕЙНОМ, категории: Загородные дома и таунхаусы Очаково-Матвеевское",-60.724766,10.185107,семейный таунхаус бассейн  загородный дом таунхаус очаково матвеевский,таунхаус,65
"ДОМ МУЗЫКИ И ТВОРЧЕСТВА, категории: Театры и ДК Южное Тушино",-34.212624,14.112149,дом музыка творчество  театр дк южный тушино,дом,18
"САМОБЫТНЫЙ ТВОРЧЕСКИЙ ЦЕНТР, категории: Театры и ДК Хамовники",0.7241267,6.5858436,самобытный творческий центр  театр дк хамовник,центр,74
"Модный офис, категории: Офисы Пресненский",16.573517,32.271347,модный офис  офис пресненский,офис,42
"Спортивный павильон, категории: Футбол, баскетболл, волейболл, теннис Басманный",-37.46527,4.1572576,спортивный павильон  футбол баскетболла волейболла теннис басманный,футбол,72
"Теннисный ангар с кафе, категории: Футбол, баскетболл, волейболл, теннис Печатники ПРОСТРАНСТВА",-34.485466,5.808568,теннисный ангар кафе  футбол баскетболла волейболла теннис печатник пространство,ангар,2
"Квартира интеллигента, категории: Квартиры Тверской",-13.209605,-39.688316,квартира интеллигент  квартира тверской,квартира,27
"Территория у бизнес-центра , категории: Бизнес-центры Беговой",-7.483435,10.701249,территория бизнес-центр  бизнес-центр беговой,none,0
"Подземная парковка бизнес-центра, категории: Гаражи и парковки Беговой",9.493387,-26.16904,подземный парковка бизнес-центр  гараж парковка беговой,парковка,44
"Веселая квартира, категории: Квартиры Арбат",-20.948792,-39.832745,веселый квартира  квартира арбат,квартира,27
"Квартира творческой семьи, категории: Квартиры Пресненский",-12.349425,-37.641956,квартира творческий семья  квартира пресненский,квартира,27
"Спортивный ангар, категории: Футбол, баскетболл, волейболл, теннис Таганский",-35.743076,3.3718898,спортивный ангар  футбол баскетболла волейболла теннис таганский,ангар,2
"Офисное пространство с современной столовой, категории: Бизнес-центры Перово Кабинеты, переговорные",27.171509,32.209705,офисный пространство современный столовая  бизнес-центр перово кабинет переговорный,пространство,54
"Современный театр  классического типа, категории: Концертные залы Мещанский",-22.550089,4.9686856,современный театр классический тип  концертный зал мещанский,театр,66
"Крыша с видом на центр, категории: Крыши Тверской",20.350143,-13.716731,крыша вид центр  крыша тверская,крыша,34
"Классический концертный зал, категории: Концертные залы Хамовники",-33.110752,-3.6166883,классический концертный зал  концертный зал хамовник,зал,20
"Клиника лазерной медицины, категории: Частные клиники Пресненский",-52.41065,-25.382483,клиника лазерный медицина  частный клиника пресненский,клиника,30
"Офис небольшой компании, категории: Офисы Пресненский",20.175934,27.852625,офис небольшой компания  офис пресненский,офис,42
"Современное выставочное пространство, категории: Арт-галереи и выставочные залы Арбат",-19.143566,7.1271133,современный выставочный пространство  арт галерея выставочный зал арбат,пространство,54
"Обычный автосервис, категории: Нагорный район Автосервисы, автотрассы",4.6796446,24.661917,обычный автосервис  нагорный район автосервис автотрасса,автосервис,1
"Дача художника, категории: Загородные дома и таунхаусы",-55.6203,12.014956,дача художник  загородный дом таунхаус,дом,18
"ПЛОЩАДКА ДЛЯ КЕРЛИНГА С РЕСТОРАНОМ, категории: Другие виды спорта Беговой",-11.893,27.478514,площадка керлинг ресторан  вид спорт беговой,площадка,46
"ПРОСТОРНЫЙ ДОМ КУЛЬТУРЫ, категории: Театры и ДК Ясенево",-34.24201,14.162835,просторный дом культура  театр дк ясенево,дом,18
"СПОРТИВНЫЙ ЦЕНТР, категории: Фитнес-клубы Бассейны Войковский",-28.510386,-12.7362585,спортивный центр  фитнес-клуб бассейн войковский,центр,74
"ШКОЛА СО СТАРЫМ РЕМОНТОМ, категории: Школы Таганский Футбол, баскетболл, волейболл, теннис",-35.618103,3.4369652,школа старый ремонт  школа таганский футбол баскетболла волейболла теннис,школа,75
"ОБРАЗОВАТЕЛЬНЫЙ ЦЕНТР С БАССЕЙНОМ, категории: Мастерские и студии Университеты Футбол, баскетболл, волейболл, теннис Бассейны Якиманка ПРОСТРАНСТВА",-38.97731,2.0352702,образовательный центр бассейн  мастерская студия университет футбол баскетболла волейболла теннис бассейн якиманка пространство,центр,74
"РАЙОННЫЙ ДОМ КУЛЬТУРЫ, категории: Театры и ДК Кунцево",-33.51409,15.136573,районный дом культура  театр дк кунцево,дом,18
"ТОРГОВАЯ ГАЛЕРЕЯ СО СВЕТЛЫМ АТРИУМОМ, категории: ТЦ, магазины",5.753729,28.953186,торговый галерея светлый атриум  тц магазин,галерея,14
"ВХОДНЫЕ ГРУППЫ ВЫСОКОКЛАССНОГО ОФИСНОГО ЗДАНИЯ, категории: Бизнес-центры Замоскворечье",2.8920038,13.160826,входной группа высококлассный офисный здание  бизнес-центр замоскворечье,здание,22
"ОФИС ГОСУДАРСТВЕННОЙ ОРГАНИЗАЦИИ, категории: Офисы Красносельский",18.567017,35.63027,офис государственный организация  офис красносельский,офис,42
"ПРЕДСТАВИТЕЛЬСКИЙ ОФИС С ДОРОГОЙ МЕБЕЛЬЮ, категории: Офисы Пресненский",15.033478,30.320892,представительский офис дорога мебель  офис пресненский,офис,42
"ОБЫКНОВЕННАЯ КВАРТИРА БОЛЬШОЙ СЕМЬИ, категории: Квартиры Пресненский",-12.63495,-43.179745,обыкновенный квартира большой семья  квартира пресненский,квартира,27
"ОФИСНОЕ ПРОСТРАНСТВО С КИРПИЧНЫМИ СТЕНАМИ, категории: Офисы Даниловский район",23.023077,36.546974,офисный пространство кирпичный стена  офис даниловский район,пространство,54
"СВЕТЛАЯ КВАРТИРА С ОТКРЫТОЙ КУХНЕЙ, категории: Квартиры Академический район",-25.450068,-46.927578,светлый квартира открытый кухня  квартира академический район,квартира,27
"ОФИС КРЕАТИВНОЙ КОМПАНИИ, категории: Офисы Замоскворечье",24.724724,34.01224,офис креативный компания  офис замоскворечье,офис,42
"СЕМЕЙНЫЙ ЗАГОРОДНЫЙ ДОМ, категории: Загородные дома и таунхаусы Можайский район",-60.448826,8.297525,семейный загородный дом  загородный дом таунхаус можайский район,дом,18
"МОНУМЕНТАЛЬНЫЙ ДОМ КУЛЬТУРЫ, категории: Театры и ДК Текстильщики",-33.550293,15.814175,монументальный дом культура  театр дк текстильщик,дом,18
"ОФИСНОЕ ПОМЕЩЕНИЕ СО СТЕКЛЯННЫМИ ЭЛЕМЕНТАМИ В ДИЗАЙНЕ, категории: Офисы Дорогомилово",26.71353,33.25904,офисный помещение стеклянный элемент дизайн  офис дорогомилово,помещение,51
"КАРТИНГ-ЦЕНТР, категории: Другие виды спорта Савёловский",-11.058735,12.04865,картинг центр  вид спорт савеловский,центр,74
"СВЕТЛАЯ ТАНЦЕВАЛЬНАЯ СТУДИЯ, категории: Другие виды спорта Беговой",2.8253815,-2.6500833,светлый танцевальный студия  вид спорт беговой,студия,63
"СОВРЕМЕННЫЙ МЕДИЦИНСКИЙ ЦЕНТР, категории: Салоны красоты и частные клиники Дорогомилово",-45.75053,-28.666515,современный медицинский центр  салон красота частный клиника дорогомилово,центр,74
"ДИЗАЙНЕРСКИЙ ЗАГОРОДНЫЙ ДОМ, категории: Загородные дома и таунхаусы Кунцево",-55.118958,13.336071,дизайнерский загородный дом  загородный дом таунхаус кунцево,дом,18
"НЕОБЫЧНЫЙ КИНОТЕАТР, категории: Басманный КИНОТЕАТРЫ ",8.604753,-23.388683,необычный кинотеатр  басманный кинотеатр,кинотеатр,28
"КАМЕРНЫЙ КИНОТЕАТР, категории: Лефортово КИНОТЕАТРЫ ",-2.1868591,-23.933455,камерный кинотеатр  лефортово кинотеатр,кинотеатр,28
"ОБЫЧНАЯ РАЙОННАЯ ШКОЛА, категории: Школы Северное Тушино Театры и ДК Футбол, баскетболл, волейболл, теннис",-35.297134,7.5898423,обычный районный школа  школа северный тушино театр дк футбол баскетболла волейболла теннис,школа,75
"ДОМ С ЭКЛЕКТИЧНЫМИ ИНТЕРЬЕРАМИ, категории: Загородные дома и таунхаусы",-58.138577,8.655913,дом эклектичный интерьер  загородный дом таунхаус,дом,18
"СОВРЕМЕННЫЙ ЦЕНТР КУЛЬТУРЫ, категории: Театры и ДК Чертаново Северное",-3.4126728,18.932444,современный центр культура  театр дк чертаново северный,центр,74
"ТЕАТР С КЛАССИЧЕСКИМ РЕПЕРТУАРОМ, категории: Театры и ДК Пресненский",0.69809127,7.042982,театр классический репертуар  театр дк пресненский,театр,66
"ПРЕСТИЖНЫЙ САЛОН КРАСОТЫ, категории: Салоны красоты и частные клиники Пресненский",-51.420795,-26.937763,престижный салон красота  салон красота частный клиника пресненский,салон,59
"САЛОН КРАСОТЫ СО СВЕТЛЫМ ИНТЕРЬЕРОМ, категории: Салоны красоты и частные клиники Якиманка",-46.86383,-28.647184,салон красота светлый интерьер  салон красота частный клиника якиманка,салон,59
"Квартира для большой семьи , категории: Квартиры Тверской",-17.36733,-44.570415,квартира большой семья  квартира тверской,квартира,27
"Квартира благородной семьи, категории: Квартиры Тверской",-20.363705,-41.229515,квартира благородный семья  квартира тверской,квартира,27
"Дом для большой семьи, категории: Загородные дома и таунхаусы",-54.662285,12.500386,дом большой семья  загородный дом таунхаус,дом,18
"Ассиметричный загородный дом, категории: Загородные дома и таунхаусы",-58.932762,13.686982,ассиметричный загородный дом  загородный дом таунхаус,дом,18
"Загородная галлерея художника, категории: Арт-галереи и выставочные залы",-17.36857,9.975869,загородный галлерея художник  арт галерея выставочный зал,арт,4
"Современный офис в старинном здании, категории: Офисы Басманный",24.846914,30.18206,современный офис старинный здание  офис басманный,офис,42
"Гостиница советских времен, категории: Отели, гостиницы, хостелы Алексеевский",-27.625677,11.463962,гостиница советский время  отель гостиница хостел алексеевский,гостиница,17
"Многофункциональный центр для бизнес мероприятий, категории: Конференц-залы Отели, гостиницы, хостелы Концертные залы Алексеевский",-19.7413,8.478515,многофункциональный центр бизнес мероприятие  конференц-зал отель гостиница хостел концертный зал алексеевский,центр,74
"СОВРЕМЕННАЯ КВАРТИРА-СТУДИЯ, категории: Квартиры Басманный",-22.965103,-43.496243,современный квартира студия  квартира басманный,квартира,27
"Убежище архитекторов и инженеров , категории: Офисы Хамовники",-0.35199052,27.590992,убежище архитектор инженер  офис хамовник,офис,42
"КВАРТИРА МОЛОДОЙ СЕМЬИ, категории: Квартиры Пресненский",-12.278316,-37.612755,квартира молодой семья  квартира пресненский,квартира,27
"КВАРТИРА ГЕНЕРАЛА, категории: Квартиры Тверской",-19.21663,-40.33021,квартира генерал  квартира тверской,квартира,27
"КВАРТИРА С ВИНТАЖНЫМИ ЭЛЕМЕНТАМИ, категории: Квартиры Пресненский",-13.887649,-36.354465,квартира винтажный элемент  квартира пресненский,квартира,27
"ПРОМЫШЛЕННЫЕ КОРИДОРЫ, категории: Подвалы Басманный",-25.766037,-12.614921,промышленный коридор  подвал басманный,подвал,49
"БЕЛОЕ ВЫСТАВОЧНОЕ ПРОСТРАНСТВО, категории: Басманный ПРОСТРАНСТВА",16.183514,-9.472733,белый выставочный пространство  басманный пространство,пространство,54
"ОФИС РЕКЛАМНОГО АГЕНСТВА, категории: Офисы Якиманка",18.543137,35.16181,офис рекламный агенство  офис якиманка,офис,42
"СЕМЕЙНЫЙ ЗАГОРОДНЫЙ ДОМ, категории: Загородные дома и таунхаусы",-61.26358,9.7006235,семейный загородный дом  загородный дом таунхаус,дом,18
"КВАРТИРА ХОЛОСТЯКА, категории: Квартиры Щукино",-17.48592,-34.443497,квартира холостяк  квартира щукино,квартира,27
"ТВОРЧЕСКАЯ МАСТЕРСКАЯ, категории: Мастерские и студии Якиманка",-13.288547,-20.497763,творческий мастерская  мастерская студия якиманка,мастерская,38
"БЕЛОСНЕЖНАЯ КВАРТИРА, категории: Квартиры Таганский",-13.190017,-38.601337,белоснежный квартира  квартира таганский,квартира,27
"СЕРЫЙ ОФИС, категории: Офисы Аэропорт",30.16939,36.26563,серый офис  офис аэропорт,офис,42
"ОФИС С ЯРКИМИ ЭЛЕМЕНТАМИ, категории: Офисы Басманный",25.377491,29.390894,офис яркий элемент  офис басманный,офис,42
"УЮТНЫЙ КОВОРКИНГ, категории: Офисы Красносельский",12.805944,24.037113,уютный коворкинг  офис красносельский,офис,42
"ТИПИЧНАЯ КВАРТИРА, категории: Квартиры Пресненский",-12.9496975,-38.188194,типичный квартира  квартира пресненский,квартира,27
"ТЕМНЫЙ OPEN SPACE, категории: Офисы Басманный",26.520815,29.383192,темный open space  офис басманный,офис,42
"ДЕРЕВЯННЫЙ ДОМИК В ЧЕРТЕ ГОРОДА, категории: Дачные поселки Сокол",4.303685,-26.698505,деревянный домик черта город  дачный поселок сокол,поселок,52
"УРБАНИСТИЧЕСКИЙ ЛОФТ, категории: Басманный ПРОСТРАНСТВА",15.374051,-9.010177,урбанистический лофт  басманный пространство,лофт,36
"СОВРЕМЕННЫЙ УЧЕБНЫЙ ЦЕНТР, категории: Частные учебные заведения Басманный",-29.744272,21.046524,современный учебный центр  частный учебный заведение басманный,центр,74
"НЕБОЛЬШОЙ БАРЧИК, категории: Ночные клубы и бары Басманный",-29.491522,24.077936,небольшой барчик  ночной клуб бар басманный,клуб,31
"КАФЕ В КРЕАТИВНОМ КЛАСТЕРЕ, категории: Рестораны и кафе Басманный",-16.463448,50.378986,кафе креативный кластер  ресторан кафе басманный,кафе,25
"СРУБ С БАНЕЙ, категории: Жилые помещения Загородные дома и таунхаусы Ярославский",-55.70845,8.411225,сруб баня  жилой помещение загородный дом таунхаус ярославский,баня,6
"ДЕРЕВЯНЫЙ ДОМ, категории: Загородные дома и таунхаусы Северное Медведково",-55.992046,14.018554,деревяный дом  загородный дом таунхаус северный медведково,дом,18
"ТЕМНЫЙ ДОМ, категории: Загородные дома и таунхаусы",-61.25222,9.494322,темный дом  загородный дом таунхаус,дом,18
"СОЛИДНЫЙ ДОМ, категории: Загородные дома и таунхаусы Северный",-56.109806,13.397975,солидный дом  загородный дом таунхаус северный,дом,18
"КЛАССИЧЕСКИЙ ТЕАТР, категории: Театры и ДК Беговой",0.08041349,8.181742,классический театр  театр дк беговой,театр,66
"ПАВИЛЬОН ДЛЯ СЪЕМОК ПОД ВОДОЙ, категории: Печатники СТУДИИ",0.45335028,3.8610272,павильон съемка вода  печатник студия,печатник,45
"Многофункциональный центр, категории: Бизнес-центры Концертные залы Марьина Роща",-25.142927,-10.0859995,многофункциональный центр  бизнес-центр концертный зал марьин роща,центр,74
"МОЛОДЕЖНЫЙ КОВОРКИНГ, категории: Офисы Бутырский",25.343086,29.082914,молодежный коворкинг  офис бутырский,офис,42
"Дом в стиле IKEA, категории: Загородные дома и таунхаусы",-61.09341,12.3881645,дом стиль ikea  загородный дом таунхаус,дом,18
"Павильон в стиле лофт, категории: Тверской ПРОСТРАНСТВА",-16.964859,5.567909,павильон стиль лофт  тверской пространство,лофт,36
"Эклектичная квартира, категории: Квартиры Тверской",-20.379023,-40.51585,эклектичный квартира  квартира тверской,квартира,27
"КВАРТИРА ХАЙТЕК, категории: Квартиры Пресненский",-12.952344,-38.312317,квартира хайтек  квартира пресненский,квартира,27
"КРАСНЫЙ ОФИС, категории: Офисы Бутырский Гагаринский район",28.903744,36.815308,красный офис  офис бутырский гагаринский район,офис,42
"Самосвал гараж, категории: Гаражи и парковки Северное Бутово Автосервисы, автотрассы",8.374667,29.744326,самосвал гараж  гараж парковка северный бутово автосервис автотрасса,гараж,15
"Красный воробей, категории: Библиотеки Арбат",-13.702363,-31.5177,красный воробей  библиотека арбат,библиотека,9
"Вези фуру, категории: Лианозово Автосервисы, автотрассы",3.1160975,20.808765,везти фура  лианозово автосервис автотрасса,автосервис,1
"Подснежник, категории: Набережные, пляжи Строгино ПРОСТРАНСТВА",4.426928,-11.487785,подснежник  набережная пляж строгино пространство,набережная,39
